{
  "$id": "urn:completetech:security-checker:snapshot:1.0",
  "$schema": "https://json-schema.org/draft/2020-12/schema",
  "additionalProperties": false,
  "properties": {
    "created_at": {
      "format": "date",
      "type": "string"
    },
    "rules": {
      "items": {
        "additionalProperties": false,
        "properties": {
          "advisories": {
            "items": {
              "maxLength": 128,
              "pattern": "^[A-Za-z0-9][A-Za-z0-9_.:-]{0,127}(?![\\s\\S])",
              "type": "string"
            },
            "maxItems": 100,
            "minItems": 0,
            "type": "array"
          },
          "affected": {
            "items": {
              "additionalProperties": false,
              "properties": {
                "branch": {
                  "maxLength": 64,
                  "minLength": 1,
                  "pattern": "^[^\\x00-\\x1f\\x7f-\\x9f]*(?![\\s\\S])",
                  "type": "string"
                },
                "fixed": {
                  "anyOf": [
                    {
                      "maxLength": 128,
                      "minLength": 1,
                      "pattern": "^[^\\x00-\\x1f\\x7f-\\x9f]*(?![\\s\\S])",
                      "type": "string"
                    },
                    {
                      "type": "null"
                    }
                  ]
                },
                "introduced": {
                  "anyOf": [
                    {
                      "maxLength": 128,
                      "minLength": 1,
                      "pattern": "^[^\\x00-\\x1f\\x7f-\\x9f]*(?![\\s\\S])",
                      "type": "string"
                    },
                    {
                      "type": "null"
                    }
                  ]
                },
                "last_affected": {
                  "anyOf": [
                    {
                      "maxLength": 128,
                      "minLength": 1,
                      "pattern": "^[^\\x00-\\x1f\\x7f-\\x9f]*(?![\\s\\S])",
                      "type": "string"
                    },
                    {
                      "type": "null"
                    }
                  ]
                },
                "source_ids": {
                  "items": {
                    "maxLength": 128,
                    "pattern": "^[A-Za-z0-9][A-Za-z0-9_.:-]{0,127}(?![\\s\\S])",
                    "type": "string"
                  },
                  "maxItems": 100,
                  "minItems": 1,
                  "type": "array"
                }
              },
              "required": [
                "branch",
                "introduced",
                "fixed",
                "last_affected",
                "source_ids"
              ],
              "type": "object"
            },
            "maxItems": 100,
            "minItems": 0,
            "type": "array"
          },
          "component": {
            "maxLength": 128,
            "minLength": 1,
            "pattern": "^[^\\x00-\\x1f\\x7f-\\x9f]*(?![\\s\\S])",
            "type": "string"
          },
          "enabled": {
            "type": "boolean"
          },
          "id": {
            "maxLength": 128,
            "pattern": "^[A-Za-z0-9][A-Za-z0-9_.:-]{0,127}(?![\\s\\S])",
            "type": "string"
          },
          "mitigations": {
            "items": {
              "additionalProperties": false,
              "properties": {
                "description": {
                  "maxLength": 4096,
                  "minLength": 1,
                  "pattern": "^[^\\x00-\\x1f\\x7f-\\x9f]*(?![\\s\\S])",
                  "type": "string"
                },
                "id": {
                  "maxLength": 128,
                  "pattern": "^[A-Za-z0-9][A-Za-z0-9_.:-]{0,127}(?![\\s\\S])",
                  "type": "string"
                },
                "source_ids": {
                  "items": {
                    "maxLength": 128,
                    "pattern": "^[A-Za-z0-9][A-Za-z0-9_.:-]{0,127}(?![\\s\\S])",
                    "type": "string"
                  },
                  "maxItems": 100,
                  "minItems": 1,
                  "type": "array"
                }
              },
              "required": [
                "id",
                "description",
                "source_ids"
              ],
              "type": "object"
            },
            "maxItems": 100,
            "minItems": 0,
            "type": "array"
          },
          "notes": {
            "items": {
              "maxLength": 4096,
              "minLength": 0,
              "pattern": "^[^\\x00-\\x1f\\x7f-\\x9f]*(?![\\s\\S])",
              "type": "string"
            },
            "maxItems": 100,
            "minItems": 0,
            "type": "array"
          },
          "preconditions": {
            "items": {
              "additionalProperties": false,
              "properties": {
                "description": {
                  "maxLength": 4096,
                  "minLength": 1,
                  "pattern": "^[^\\x00-\\x1f\\x7f-\\x9f]*(?![\\s\\S])",
                  "type": "string"
                },
                "id": {
                  "maxLength": 128,
                  "pattern": "^[A-Za-z0-9][A-Za-z0-9_.:-]{0,127}(?![\\s\\S])",
                  "type": "string"
                },
                "source_ids": {
                  "items": {
                    "maxLength": 128,
                    "pattern": "^[A-Za-z0-9][A-Za-z0-9_.:-]{0,127}(?![\\s\\S])",
                    "type": "string"
                  },
                  "maxItems": 100,
                  "minItems": 1,
                  "type": "array"
                }
              },
              "required": [
                "id",
                "description",
                "source_ids"
              ],
              "type": "object"
            },
            "maxItems": 100,
            "minItems": 0,
            "type": "array"
          },
          "revision": {
            "minimum": 1,
            "type": "integer"
          },
          "sources": {
            "items": {
              "additionalProperties": false,
              "properties": {
                "id": {
                  "maxLength": 128,
                  "pattern": "^[A-Za-z0-9][A-Za-z0-9_.:-]{0,127}(?![\\s\\S])",
                  "type": "string"
                },
                "publisher": {
                  "maxLength": 128,
                  "minLength": 1,
                  "pattern": "^[^\\x00-\\x1f\\x7f-\\x9f]*(?![\\s\\S])",
                  "type": "string"
                },
                "url": {
                  "format": "uri",
                  "maxLength": 2048,
                  "type": "string"
                },
                "verified_at": {
                  "format": "date",
                  "type": "string"
                }
              },
              "required": [
                "id",
                "url",
                "publisher",
                "verified_at"
              ],
              "type": "object"
            },
            "maxItems": 100,
            "minItems": 0,
            "type": "array"
          },
          "title": {
            "maxLength": 256,
            "minLength": 1,
            "pattern": "^[^\\x00-\\x1f\\x7f-\\x9f]*(?![\\s\\S])",
            "type": "string"
          },
          "verification_status": {
            "enum": [
              "verified",
              "unverified",
              "disputed"
            ],
            "type": "string"
          },
          "verified_at": {
            "anyOf": [
              {
                "format": "date",
                "type": "string"
              },
              {
                "type": "null"
              }
            ]
          },
          "version_scheme": {
            "enum": [
              "semver",
              "vendor"
            ],
            "type": "string"
          }
        },
        "required": [
          "id",
          "revision",
          "title",
          "component",
          "advisories",
          "enabled",
          "verification_status",
          "verified_at",
          "version_scheme",
          "affected",
          "preconditions",
          "mitigations",
          "sources",
          "notes"
        ],
        "type": "object"
      },
      "maxItems": 1000,
      "minItems": 0,
      "type": "array"
    },
    "schema_version": {
      "const": "1.0"
    },
    "snapshot_id": {
      "maxLength": 128,
      "pattern": "^[A-Za-z0-9][A-Za-z0-9_.:-]{0,127}(?![\\s\\S])",
      "type": "string"
    }
  },
  "required": [
    "schema_version",
    "snapshot_id",
    "created_at",
    "rules"
  ],
  "title": "CompleteTech security checker snapshot v1.0",
  "type": "object"
}
